{
  "datasetVersion": "1",
  "createdAt": "2026-09-14",
  "sourceRetrievalDate": "2026-09-14",
  "sourceAuthority": "U.S. Consumer Product Safety Commission (CPSC)",
  "recalls": [
    {
      "recallNoticeId": "cpsc-10917",
      "source": {
        "authority": "CPSC",
        "externalId": "10917",
        "officialUrl": "https://www.cpsc.gov/Recalls/2026/TooyBing-Wooden-Bead-Stacking-Toys-Recalled-Due-to-Risk-of-Serious-Injury-or-Death-from-Choking-Violate-Small-Parts-Ban",
        "retrievedAt": "2026-09-14"
      },
      "title": "TooyBing Wooden Bead Stacking Toys Recalled Due to Choking Hazard",
      "description": "CPSC identifies the TooyBing Wooden Bead Stacking Toy as model TB-MZWJ.",
      "hazard": null,
      "remedy": null,
      "recallDate": "2026-08-13",
      "scopes": [
        {
          "productName": "TooyBing Wooden Bead Stacking Toy",
          "brand": "TooyBing",
          "modelNumber": "TB-MZWJ"
        }
      ],
      "rawEvidence": {
        "cpscRecallId": "10917",
        "officialDescription": "CPSC identifies the TooyBing Wooden Bead Stacking Toy as model TB-MZWJ."
      }
    },
    {
      "recallNoticeId": "cpsc-10920",
      "source": {
        "authority": "CPSC",
        "externalId": "10920",
        "officialUrl": "https://www.cpsc.gov/Recalls/2026/COMMOWNER-Pressure-Washers-Recalled-Due-to-Serious-Risk-of-Injury-or-Death-from-Shock-and-Electrocution-Hazards-Imported-by-AZ-Home-Concept",
        "retrievedAt": "2026-09-14"
      },
      "title": "COMMOWNER Pressure Washers Recalled Due to Shock and Electrocution Hazards",
      "description": "CPSC identifies COMMOWNER pressure washer model HD14P-Z, also listed at purchase as HX18.",
      "hazard": null,
      "remedy": null,
      "recallDate": "2026-08-13",
      "scopes": [
        {
          "productName": "COMMOWNER Electric Pressure Washer",
          "brand": "COMMOWNER",
          "modelNumber": "HD14P-Z"
        },
        {
          "productName": "COMMOWNER Electric Pressure Washer",
          "brand": "COMMOWNER",
          "modelNumber": "HX18"
        }
      ],
      "rawEvidence": {
        "cpscRecallId": "10920",
        "officialDescription": "CPSC identifies COMMOWNER pressure washer model HD14P-Z, also listed at purchase as HX18."
      }
    },
    {
      "recallNoticeId": "cpsc-10921",
      "source": {
        "authority": "CPSC",
        "externalId": "10921",
        "officialUrl": "https://www.cpsc.gov/Recalls/2026/Yamazuki-Recalls-Youth-All-Terrain-Vehicles-ATVs-Due-to-Risk-of-Serious-Injury-or-Death-from-Crash-Hazard-Violates-Mandatory-Standard-for-ATVs",
        "retrievedAt": "2026-09-14"
      },
      "title": "Yamazuki Recalls Youth All-Terrain Vehicles Due to Crash Hazard",
      "description": "CPSC identifies QEASET- or HOVERHEART-branded youth ATV model XW-A19.",
      "hazard": null,
      "remedy": null,
      "recallDate": "2026-08-13",
      "scopes": [
        {
          "productName": "Yamazuki Youth All-Terrain Vehicle",
          "modelNumber": "XW-A19"
        }
      ],
      "rawEvidence": {
        "cpscRecallId": "10921",
        "officialDescription": "CPSC identifies QEASET- or HOVERHEART-branded youth ATV model XW-A19."
      }
    },
    {
      "recallNoticeId": "cpsc-10922",
      "source": {
        "authority": "CPSC",
        "externalId": "10922",
        "officialUrl": "https://www.cpsc.gov/Recalls/2026/GigaCloud-Technology-USA-Recalls-Merax-Murphy-Beds-Due-to-Risk-of-Serious-Injury-or-Death-from-Impact-and-Crush-Hazards",
        "retrievedAt": "2026-09-14"
      },
      "title": "GigaCloud Technology USA Recalls Merax Murphy Beds Due to Impact and Crush Hazards",
      "description": "CPSC lists Murphy bed models GX000392AAK, GX000391AAK, and GX000383AAK with associated SKU groups.",
      "hazard": null,
      "remedy": null,
      "recallDate": "2026-08-13",
      "scopes": [
        {
          "productName": "Merax Murphy Beds"
        }
      ],
      "rawEvidence": {
        "cpscRecallId": "10922",
        "officialDescription": "CPSC lists Murphy bed models GX000392AAK, GX000391AAK, and GX000383AAK with associated SKU groups.",
        "explicitCriteria": [
          {
            "criterion": "modelNumber",
            "value": "GX000392AAK",
            "productName": "Merax Full-Size Murphy Bed",
            "context": "CPSC explicitly associates model GX000392AAK with the full-size Murphy bed and its SKU group."
          }
        ],
        "completeCriterionSets": [
          {
            "criterion": "modelNumber",
            "values": ["GX000392AAK", "GX000391AAK", "GX000383AAK"],
            "productName": "Merax Murphy Bed",
            "context": "CPSC supplies the complete affected model-number table."
          }
        ]
      }
    },
    {
      "recallNoticeId": "cpsc-10926",
      "source": {
        "authority": "CPSC",
        "externalId": "10926",
        "officialUrl": "https://www.cpsc.gov/Recalls/2026/CuberShop-Magnetic-Speed-Cubes-Recalled-Due-to-Risk-of-Serious-Injury-or-Death-from-Magnet-Ingestion-Violate-Mandatory-Standard-for-Toys-Imported-by-SKY-CUBE-HK",
        "retrievedAt": "2026-09-14"
      },
      "title": "CuberShop Magnetic Speed Cubes Recalled Due to Magnet Ingestion Hazard",
      "description": "CPSC identifies CuberShop Magnetic Stickerless Speed Cube model YJ MGC 5×5.",
      "hazard": null,
      "remedy": null,
      "recallDate": "2026-08-13",
      "scopes": [
        {
          "productName": "CuberShop Magnetic Stickerless Speed Cube",
          "brand": "CuberShop",
          "modelNumber": "YJ MGC 5×5"
        }
      ],
      "rawEvidence": {
        "cpscRecallId": "10926",
        "officialDescription": "CPSC identifies CuberShop Magnetic Stickerless Speed Cube model YJ MGC 5×5."
      }
    },
    {
      "recallNoticeId": "cpsc-10929",
      "source": {
        "authority": "CPSC",
        "externalId": "10929",
        "officialUrl": "https://www.cpsc.gov/Recalls/2026/Sunnyside-Corporation-Recalls-1-K-Kerosene-Heater-and-Appliance-Fuel-Containers-Due-to-Risk-of-Serious-Injury-or-Death-from-Flash-Fire-and-Burn-Hazard-Violates-Mandatory-Standards-for-Portable-Fuel-Containers",
        "retrievedAt": "2026-09-14"
      },
      "title": "Sunnyside Recalls 1-K Kerosene Heater and Appliance Fuel Containers",
      "description": "CPSC limits the recalled Sunnyside gallon 1-K kerosene containers to batch number 26082.",
      "hazard": null,
      "remedy": null,
      "recallDate": "2026-08-13",
      "scopes": [
        {
          "productName": "Sunnyside 1-K Kerosene Heater and Appliance Fuel Container",
          "brand": "Sunnyside"
        }
      ],
      "rawEvidence": {
        "cpscRecallId": "10929",
        "officialDescription": "CPSC limits the recalled Sunnyside gallon 1-K kerosene containers to batch number 26082.",
        "explicitCriteria": [
          {
            "criterion": "lotNumber",
            "value": "26082",
            "productName": "Sunnyside 1-K Kerosene Heater and Appliance Fuel Container",
            "brand": "Sunnyside",
            "context": "CPSC explicitly identifies batch number 26082."
          }
        ],
        "completeCriterionSets": [
          {
            "criterion": "lotNumber",
            "values": ["26082"],
            "productName": "Sunnyside 1-K Kerosene Heater and Appliance Fuel Container",
            "brand": "Sunnyside",
            "context": "CPSC identifies one affected batch number: 26082."
          }
        ]
      }
    },
    {
      "recallNoticeId": "cpsc-10939",
      "source": {
        "authority": "CPSC",
        "externalId": "10939",
        "officialUrl": "https://www.cpsc.gov/Recalls/2026/Truststone-Group-Recalls-XO-Poppy-Power-Trip-Magnetic-Wireless-Power-Banks-Due-to-Fire-and-Burn-Hazards-Sold-Exclusively-at-TJX-and-Marshalls-Stores",
        "retrievedAt": "2026-09-14"
      },
      "title": "Truststone Group Recalls XO Poppy Power Trip Magnetic Wireless Power Banks",
      "description": "CPSC identifies three packaging model numbers for XO Poppy PYPBK5M power banks.",
      "hazard": null,
      "remedy": null,
      "recallDate": "2026-09-03",
      "scopes": [
        {
          "productName": "XO Poppy Power Trip Magnetic Wireless Power Bank",
          "brand": "XO Poppy"
        }
      ],
      "rawEvidence": {
        "cpscRecallId": "10939",
        "officialDescription": "CPSC identifies three packaging model numbers for XO Poppy PYPBK5M power banks.",
        "explicitCriteria": [
          {
            "criterion": "modelNumber",
            "value": "PY-PBK5M-CR2",
            "productName": "XO Poppy Power Trip Magnetic Wireless Power Bank",
            "brand": "XO Poppy",
            "context": "CPSC explicitly associates PY-PBK5M-CR2 with the cream-colored affected power bank."
          }
        ],
        "completeCriterionSets": [
          {
            "criterion": "modelNumber",
            "values": ["PY-PBK5M-CR2", "PY-PBK5M-BW8", "PY-PBK5M-TB2"],
            "productName": "XO Poppy Power Trip Magnetic Wireless Power Bank",
            "brand": "XO Poppy",
            "context": "CPSC supplies the three specific affected packaging model numbers."
          }
        ]
      }
    },
    {
      "recallNoticeId": "cpsc-10941",
      "source": {
        "authority": "CPSC",
        "externalId": "10941",
        "officialUrl": "https://www.cpsc.gov/Recalls/2026/Nanjing-Wu-Hai-Smart-Home-Appliance-Store-Recalls-Alanca-6-Drawer-Dressers-Due-to-Risk-of-Serious-Injury-or-Death-from-Tip-Over-and-Entrapment-Hazards-Violate-Mandatory-Standard-for-Clothing-Storage-Units",
        "retrievedAt": "2026-09-14"
      },
      "title": "Alanca 6-Drawer Dressers Recalled Due to Tip-Over and Entrapment Hazards",
      "description": "CPSC identifies Alanca dresser models WH-DS02-6W and WH-DS02-6GE.",
      "hazard": null,
      "remedy": null,